{
  "schema_version": "1.0", "index_id": "screenrec-ko-001-index",
  "sources": [{"source_id": "screenrec-ko-001", "sha256": "a3a3a3a3a3a3a3a3a3a3a3a3a3a3a3a3a3a3a3a3a3a3a3a3a3a3a3a3a3a3a3a3", "duration": {"value": 1200000, "timebase": {"num": 1, "den": 1000}}, "capture": {"target": {"app": "Demo App", "window_identifier": "window-42", "permission_signal": "title_present"}, "operation_path": "human_direct", "validation": {"verdict": "pass", "off_target_frame_count": 0, "evidence_ids": ["ev-failure-frame"]}}}],
  "evidence": [
    {"evidence_id": "ev-hook", "kind": "human", "source_id": "screenrec-ko-001", "range": {"start": {"value": 0, "timebase": {"num": 1, "den": 1000}}, "end": {"value": 25000, "timebase": {"num": 1, "den": 1000}}}, "provenance": {"reviewer": "editor-1", "rationale": "opening narration reviewed"}},
    {"evidence_id": "ev-failure-frame", "kind": "frame", "source_id": "screenrec-ko-001", "range": {"start": {"value": 60000, "timebase": {"num": 1, "den": 1000}}, "end": {"value": 165000, "timebase": {"num": 1, "den": 1000}}}, "provenance": {"frame_sha256": "b4b4b4b4b4b4b4b4b4b4b4b4b4b4b4b4b4b4b4b4b4b4b4b4b4b4b4b4b4b4b4b4", "frame_time": {"value": 60000, "timebase": {"num": 1, "den": 1000}}}},
    {"evidence_id": "ev-audit", "kind": "signal", "source_id": "screenrec-ko-001", "range": {"start": {"value": 180000, "timebase": {"num": 1, "den": 1000}}, "end": {"value": 240000, "timebase": {"num": 1, "den": 1000}}}, "provenance": {"tool": "ffprobe", "version": "8.1.2", "rationale": "on-screen text interval"}}
  ],
  "markers": [
    {"marker_id": "m-1", "marker_type": "transcript_segment", "source_id": "screenrec-ko-001", "range": {"start": {"value": 0, "timebase": {"num": 1, "den": 1000}}, "end": {"value": 25000, "timebase": {"num": 1, "den": 1000}}}, "evidence_ids": ["ev-hook"]},
    {"marker_id": "m-2", "marker_type": "shot_scene_boundary", "source_id": "screenrec-ko-001", "range": {"start": {"value": 60000, "timebase": {"num": 1, "den": 1000}}, "end": {"value": 165000, "timebase": {"num": 1, "den": 1000}}}, "evidence_ids": ["ev-failure-frame"]},
    {"marker_id": "m-3", "marker_type": "onscreen_text", "source_id": "screenrec-ko-001", "range": {"start": {"value": 180000, "timebase": {"num": 1, "den": 1000}}, "end": {"value": 240000, "timebase": {"num": 1, "den": 1000}}}, "evidence_ids": ["ev-audit"]},
    {"marker_id": "m-4", "marker_type": "sensitive_information_candidate", "source_id": "screenrec-ko-001", "range": {"start": {"value": 190000, "timebase": {"num": 1, "den": 1000}}, "end": {"value": 195000, "timebase": {"num": 1, "den": 1000}}}, "evidence_ids": ["ev-audit"]}
  ],
  "transcript": [{"utterance_id": "u-1", "source_id": "screenrec-ko-001", "range": {"start": {"value": 0, "timebase": {"num": 1, "den": 1000}}, "end": {"value": 25000, "timebase": {"num": 1, "den": 1000}}}, "text": "샘플 발화 한 문장입니다.", "provenance_status": "human_reviewed", "utterance_confidence": 1, "word_confidence": 1, "speaker_confidence": 1, "word_timestamps_available": true, "words": [{"text": "샘플", "start": {"value": 0, "timebase": {"num": 1, "den": 1000}}, "end": {"value": 5000, "timebase": {"num": 1, "den": 1000}}, "confidence": 1}, {"text": "발화", "start": {"value": 5000, "timebase": {"num": 1, "den": 1000}}, "end": {"value": 10000, "timebase": {"num": 1, "den": 1000}}, "confidence": 1}]}],
  "transcription_chunks": [{"chunk_id": "stt-chunk-001", "original_range": {"start": {"value": 0, "timebase": {"num": 1, "den": 1000}}, "end": {"value": 600000, "timebase": {"num": 1, "den": 1000}}}, "actual_offset": {"value": 0, "timebase": {"num": 1, "den": 1000}}, "reassembly_evidence_ids": ["ev-hook"]}, {"chunk_id": "stt-chunk-002", "original_range": {"start": {"value": 600000, "timebase": {"num": 1, "den": 1000}}, "end": {"value": 1200000, "timebase": {"num": 1, "den": 1000}}}, "actual_offset": {"value": 600000, "timebase": {"num": 1, "den": 1000}}, "reassembly_evidence_ids": ["ev-audit"]}],
  "backend_selections": [{"purpose": "stt", "backend_id": "example-gpt-transcribe", "backend_version": "contract-example", "cost_tier": "유료"}]
}
